kind,system,code,name,parent_code,level,is_leaf,is_total
rev,rev_druhove,421,Investiční přijaté transfery od rozpočtů ústřední úrovně,42,3,False,False
rev,rev_druhove,423,Investiční přijaté transfery ze zahraničí,42,3,False,False
rev,rev_druhove,1111,Příjem z daně z příjmů fyzických osob placené plátci,111,4,True,False
rev,rev_druhove,1112,Příjem z daně z příjmů fyzických osob placené poplatníky,111,4,True,False
rev,rev_druhove,1113,Příjem z daně z příjmů fyzických osob vybírané srážkou podle zvláštní sazby daně,111,4,True,False
rev,rev_druhove,1211,Příjem z daně z přidané hodnoty,121,4,True,False
rev,rev_druhove,4118,Neinvestiční převody z Národního fondu,411,4,True,False
rev,rev_druhove,4153,Neinvestiční transfery přijaté od Evropské unie,415,4,True,False
rev,rev_druhove,4218,Investiční převody z Národního fondu,421,4,True,False
rev,rev_druhove,4233,Investiční transfery přijaté od Evropské unie,423,4,True,False
